{
  "_meta": {
    "title": "Career Overlay (seed)",
    "schema": "schema/career_overlay.schema.json",
    "version": "0.1.0-seed",
    "status": "SEED — AI-risk + generic level transitions for Career Path. Family bridges and per-transition detail to be enriched with HR.",
    "bridges_note": "Cross-family optional career paths — 15 families, bidirectional-informed, each target has a rationale in bridge_rationale. Updated 2026-08-11."
  },
  "version": "0.1.0-seed",
  "ai_risk": {
    "gss": {
      "score": 80,
      "label": "High",
      "reason": "Routine manual/support tasks highly automatable; reskilling toward supervised/technical roles."
    },
    "ops": {
      "score": 60,
      "label": "Medium",
      "reason": "Sensing/automation reduces manual ops; shift to monitoring & exception handling."
    },
    "fin": {
      "score": 60,
      "label": "Medium",
      "reason": "Bookkeeping/closing automatable; value shifts to analysis & control."
    },
    "scm": {
      "score": 55,
      "label": "Medium",
      "reason": "Planning/PO automation; value in vendor strategy & resilience."
    },
    "qse": {
      "score": 50,
      "label": "Medium",
      "reason": "Inspection/reporting assisted by AI; judgement & compliance remain human."
    },
    "sal": {
      "score": 45,
      "label": "Medium",
      "reason": "AI assists CRM/insights; relationship & negotiation remain human."
    },
    "pmo": {
      "score": 45,
      "label": "Medium",
      "reason": "Tracking/reporting automatable; stakeholder leadership remains."
    },
    "hr": {
      "score": 45,
      "label": "Medium",
      "reason": "HR ops automatable; strategy, culture, coaching remain human."
    },
    "it": {
      "score": 40,
      "label": "Medium",
      "reason": "Code/ops assisted by AI; architecture & security judgement remain."
    },
    "eng": {
      "score": 35,
      "label": "Low",
      "reason": "Field/safety-critical engineering hard to automate; AI augments design."
    },
    "grc": {
      "score": 35,
      "label": "Low",
      "reason": "Judgement, accountability & regulator relationships remain human."
    },
    "rnd": {
      "score": 30,
      "label": "Low",
      "reason": "Discovery/innovation augmented, not replaced, by AI."
    },
    "dig": {
      "score": 25,
      "label": "Low",
      "reason": "Builds & governs the AI — demand rising."
    },
    "bds": {
      "score": 25,
      "label": "Low",
      "reason": "Strategy, deals & ambiguity-heavy work remain human."
    },
    "exe": {
      "score": 20,
      "label": "Low",
      "reason": "Leadership, accountability & enterprise judgement remain human."
    }
  },
  "bridges": {
    "fin": [
      "scm",
      "grc",
      "bds",
      "pmo"
    ],
    "hr": [
      "grc",
      "bds",
      "gss"
    ],
    "scm": [
      "fin",
      "ops",
      "bds"
    ],
    "ops": [
      "eng",
      "scm",
      "qse",
      "pmo"
    ],
    "eng": [
      "ops",
      "rnd",
      "dig",
      "pmo"
    ],
    "sal": [
      "bds",
      "dig",
      "scm"
    ],
    "it": [
      "dig",
      "eng",
      "pmo"
    ],
    "dig": [
      "it",
      "rnd",
      "bds",
      "eng"
    ],
    "pmo": [
      "bds",
      "ops",
      "eng"
    ],
    "qse": [
      "ops",
      "grc",
      "eng"
    ],
    "rnd": [
      "eng",
      "dig",
      "bds"
    ],
    "grc": [
      "fin",
      "hr",
      "qse"
    ],
    "bds": [
      "fin",
      "sal",
      "dig",
      "pmo"
    ],
    "exe": [
      "bds",
      "fin",
      "ops"
    ],
    "gss": [
      "ops",
      "hr",
      "scm"
    ]
  },
  "transitions": {
    "F1_L1": {
      "readiness": {
        "timeline": "1-2 ปี",
        "checklist": [
          "ผ่านมาตรฐานงาน/ความปลอดภัยต่อเนื่อง",
          "ได้วุฒิ/ใบรับรองที่จำเป็น (ปวส./certificate)",
          "แสดงความริเริ่มและทักษะดิจิทัลเบื้องต้น"
        ]
      },
      "learning_method": {
        "10": [
          "หลักสูตรพื้นฐาน/วุฒิวิชาชีพ"
        ],
        "20": [
          "โค้ชจากหัวหน้างาน"
        ],
        "70": [
          "ทำงานจริงภายใต้พี่เลี้ยง"
        ]
      }
    },
    "L1_L2": {
      "readiness": {
        "timeline": "2-3 ปี",
        "checklist": [
          "ทำงานได้อิสระและสม่ำเสมอ",
          "เริ่มสอนงาน/นำงานย่อย",
          "เข้าใจกระบวนการข้ามหน่วยงาน"
        ]
      },
      "learning_method": {
        "10": [
          "หลักสูตร Leadership พื้นฐาน"
        ],
        "20": [
          "mentoring จาก supervisor"
        ],
        "70": [
          "รับผิดชอบงานที่ซับซ้อนขึ้น/นำทีมเล็ก"
        ]
      }
    },
    "L2_L3": {
      "readiness": {
        "timeline": "2-4 ปี",
        "checklist": [
          "บริหารทีมและผลงานได้",
          "วางแผน/งบประมาณระดับ section",
          "คิดเชิงกลยุทธ์ของ function"
        ]
      },
      "learning_method": {
        "10": [
          "หลักสูตร Manage Function"
        ],
        "20": [
          "coaching จากผู้จัดการ"
        ],
        "70": [
          "เป็นหัวหน้าโครงการข้ามทีม"
        ]
      }
    },
    "L3_L4": {
      "readiness": {
        "timeline": "3-5 ปี",
        "checklist": [
          "รับผิดชอบผล function เต็มตัว",
          "เริ่มมุมมอง P&L/BU",
          "พัฒนาผู้นำรุ่นถัดไป"
        ]
      },
      "learning_method": {
        "10": [
          "Executive Program"
        ],
        "20": [
          "mentoring จาก Director/VP"
        ],
        "70": [
          "ดูแล BU/หน่วยธุรกิจย่อย"
        ]
      }
    },
    "L4_L5": {
      "readiness": {
        "timeline": "3-6 ปี",
        "checklist": [
          "บริหาร P&L ของธุรกิจ",
          "นำการเปลี่ยนแปลงระดับองค์กร",
          "สร้าง talent pipeline"
        ]
      },
      "learning_method": {
        "10": [
          "Senior Executive / Director (IOD)"
        ],
        "20": [
          "board exposure/coaching"
        ],
        "70": [
          "นำธุรกิจ/บริษัทย่อย"
        ]
      }
    },
    "L5_L6": {
      "readiness": {
        "timeline": "5+ ปี",
        "checklist": [
          "วิสัยทัศน์ระดับ enterprise",
          "ผลงานต่อเนื่องหลายธุรกิจ",
          "วาง successor ได้"
        ]
      },
      "learning_method": {
        "10": [
          "Global leadership program"
        ],
        "20": [
          "board & investor engagement"
        ],
        "70": [
          "นำกลุ่มธุรกิจ"
        ]
      }
    }
  },
  "bridge_rationale": {
    "fin": {
      "scm": "ทักษะต้นทุน/งบประมาณและการวิเคราะห์การเงิน ต่อยอดสู่การจัดซื้อและบริหารต้นทุนซัพพลายเชน",
      "grc": "พื้นฐานบัญชี/การควบคุมภายใน ต่อยอดสู่ตรวจสอบภายใน ความเสี่ยงและ Compliance",
      "bds": "การวิเคราะห์การเงิน/การลงทุน ต่อยอดสู่การพัฒนาธุรกิจและกลยุทธ์การลงทุน",
      "pmo": "การบริหารงบประมาณและการวิเคราะห์ ต่อยอดสู่การบริหารพอร์ตโครงการ"
    },
    "hr": {
      "grc": "งานนโยบาย/ระเบียบและธรรมาภิบาลด้านคน ต่อยอดสู่ Compliance และ Governance",
      "bds": "การออกแบบองค์กรและกลยุทธ์คน ต่อยอดสู่การพัฒนาธุรกิจ/กลยุทธ์องค์กร",
      "gss": "งานบริหารบุคคล/ธุรการต่อเนื่องกับงานสนับสนุนทั่วไป"
    },
    "scm": {
      "fin": "การบริหารต้นทุน/สัญญาจัดซื้อ เชื่อมกับการเงินและการควบคุมต้นทุน",
      "ops": "การวางแผนอุปทาน/โลจิสติกส์ ต่อยอดสู่ปฏิบัติการและการส่งมอบ",
      "bds": "Sourcing Strategy และการเจรจา ต่อยอดสู่การพัฒนาธุรกิจ"
    },
    "ops": {
      "eng": "ปฏิบัติการเชิงเทคนิค/บำรุงรักษา เชื่อมกับงานวิศวกรรม",
      "scm": "การส่งมอบและโลจิสติกส์ เชื่อมกับซัพพลายเชน",
      "qse": "มาตรฐานงาน ความปลอดภัยและคุณภาพในสายปฏิบัติการ",
      "pmo": "การบริหารงานประจำ ต่อยอดสู่การบริหารโครงการ"
    },
    "eng": {
      "ops": "งานวิศวกรรม สู่การบริหารปฏิบัติการ/บำรุงรักษา",
      "rnd": "ความรู้เชิงเทคนิค ต่อยอดสู่การวิจัยและพัฒนาผลิตภัณฑ์",
      "dig": "วิศวกรรม สู่ Digital Engineering / Automation",
      "pmo": "การนำโครงการวิศวกรรม สู่การบริหารโครงการ"
    },
    "sal": {
      "bds": "ความเข้าใจตลาด/ลูกค้า ต่อยอดสู่การพัฒนาธุรกิจและกลยุทธ์",
      "dig": "การตลาด/ลูกค้า เชื่อมกับ Digital Marketing และ Customer Platform",
      "scm": "ความต้องการตลาด (Demand) เชื่อมกับการวางแผนอุปทาน"
    },
    "it": {
      "dig": "โครงสร้างพื้นฐาน IT ต่อยอดสู่ Digital & AI Transformation",
      "eng": "ระบบ/เทคโนโลยี เชื่อมกับงานวิศวกรรมเทคนิค",
      "pmo": "การนำระบบ IT สู่การบริหารโครงการ"
    },
    "dig": {
      "it": "Digital/AI เชื่อมกลับสู่รากฐาน IT/ระบบ",
      "rnd": "นวัตกรรมดิจิทัล ต่อยอดสู่การวิจัยและพัฒนา",
      "bds": "Digital Business Model ต่อยอดสู่การพัฒนาธุรกิจ",
      "eng": "Automation/Digital Engineering เชื่อมกับวิศวกรรม"
    },
    "pmo": {
      "bds": "การบริหารพอร์ตโครงการ ต่อยอดสู่กลยุทธ์/พัฒนาธุรกิจ",
      "ops": "การบริหารโครงการ สู่การบริหารปฏิบัติการ",
      "eng": "PMO เชิงเทคนิค เชื่อมกับงานวิศวกรรม"
    },
    "qse": {
      "ops": "คุณภาพ/ความปลอดภัยฝังในสายปฏิบัติการ",
      "grc": "ESG/มาตรฐาน ต่อยอดสู่ธรรมาภิบาลและ Compliance",
      "eng": "งานคุณภาพเชิงเทคนิค เชื่อมกับวิศวกรรม"
    },
    "rnd": {
      "eng": "การวิจัยพัฒนา เชื่อมกับวิศวกรรมผลิตภัณฑ์",
      "dig": "R&D ต่อยอดสู่นวัตกรรมดิจิทัล/AI",
      "bds": "การนำผลวิจัยสู่เชิงพาณิชย์ (Commercialization)"
    },
    "grc": {
      "fin": "ตรวจสอบ/ความเสี่ยง เชื่อมกับการเงินและการควบคุมภายใน",
      "hr": "ธรรมาภิบาล/ระเบียบ เชื่อมกับนโยบายด้านคน",
      "qse": "Compliance เชื่อมกับ ESG และมาตรฐานความปลอดภัย"
    },
    "bds": {
      "fin": "กลยุทธ์/การลงทุน เชื่อมกับการเงิน",
      "sal": "การพัฒนาธุรกิจ เชื่อมกับการขาย/การตลาด",
      "dig": "กลยุทธ์ธุรกิจ เชื่อมกับ Digital Business",
      "pmo": "การพัฒนาธุรกิจ สู่การบริหารพอร์ตโครงการ"
    },
    "exe": {
      "bds": "เส้นทางกลยุทธ์/พัฒนาธุรกิจ สู่ผู้บริหารสูงสุด",
      "fin": "เส้นทาง CFO สู่ผู้บริหารสูงสุด",
      "ops": "เส้นทาง COO/ปฏิบัติการ สู่ผู้บริหารสูงสุด"
    },
    "gss": {
      "ops": "งานสนับสนุนทั่วไป เชื่อมกับปฏิบัติการ",
      "hr": "งานธุรการ/สนับสนุน เชื่อมกับงานบุคคล",
      "scm": "งานสนับสนุน/พัสดุ เชื่อมกับซัพพลายเชน"
    }
  }
}